name,monologue
Conan O'Brian,"A couple in North Carolina was arrested for attacking each other with pizza rolls. They’ve been charged with two counts of ""Deserving each other."""
Conan O'Brian,"Marvel announced that the next Iron Man will be an African-American woman. However, in keeping with Hollywood tradition, she will still be played by Robert Downey Jr."
Conan O'Brian,"The Juno satellite probe which hasn’t been heard from in five years and has been traveling through deep space finally reached Jupiter yesterday and reestablished contact with Earth. The Jupiter satellite’s first message was, ""The Republican Nominee is WHO?"""
Conan O'Brian,"Although Hillary Clinton was cleared of charges in the investigation of her deleted emails, her actions were described by the FBI as ""extremely reckless."" However in her defense, the report pointed out that she was Hillary reckless, not Bill reckless."
Conan O'Brian,"It's rumored that Snoop Dogg will perform at the Democratic Convention. When he heard this, Donald Trump immediately took him off his vice presidential list."
Conan O'Brian,"In a speech yesterday, Donald Trump praised Saddam Hussein for killing terrorists. He also said Hitler was a wonderful dancer and Stalin made a great omelette."
Conan O'Brian,"A new app has come out that describes itself as ""Uber for Sushi."" The app tells you exactly how many minutes away your E.coli is."
