name,monologue
Seth Meyers,"Harriet Tubman will be replacing Andrew Jackson on the $20 bill. It's truly exciting to have a woman on there. Although, unfortunately, due to the wage gap, it is now worth $17."
Seth Meyers,The New York primary results were a good old-fashioned Empire State boot stomping by Hillary Clinton and Donald Trump. New Yorkers haven't seen a thrashing this bad since any Knicks game. 
Seth Meyers,What really impressed me last night was the way CNN announced the winners. The winners will have their victories displayed on the Empire State building. 
Seth Meyers,"I don't think it's fair that CNN gets to control the Empire State building. They already have a beam of radiant light that delivers the news: Anderson Cooper. 


"
