name,monologue
Stephen Colbert,"Harriet Tubman will be replacing Andrew Jackson on the $20 bill. It's truly exciting to have a woman on there. Although, unfortunately, due to the wage gap, it is now worth $17."
Stephen Colbert,The New York primary results were a good old-fashioned Empire State boot stomping by Hillary Clinton and Donald Trump. New Yorkers haven't seen a thrashing this bad since any Knicks game. 
Stephen Colbert,What really impressed me last night was the way CNN announced the winners. The winners will have their victories displayed on the Empire State building. 
Stephen Colbert,"I don't think it's fair that CNN gets to control the Empire State building. They already have a beam of radiant light that delivers the news: Anderson Cooper. 


"
