name,monologue
Conan O'Brian,"President Trump is actually getting a lot of praise for his response to Hurricanes Harvey and Irma. He's getting some praise. Here's the thing, though. You know, it's not a good sign for your presidency when the best thing that happens to you is two hurricanes."
Conan O'Brian,"Anyone go out and buy Hillary Clinton's book yet? Everyone is talking about it. She has some pretty interesting revelations in that book. Hillary Clinton in her book said that after Trump's inauguration speech, George W. Bush told her, ""That was some weird ****."" That's true. It's being called the most eloquent statement ever made by George W. Bush. I can't believe he said that. They're going to carve that into his library. On the wall."
Conan O'Brian,"A few days after being accused of liking a porn tweet on Twitter, Sen. Ted Cruz dismissed the claim saying the left is obsessed with sex. Cruz then said, ""If and when they want to call me, I can recommend some great websites."""
Conan O'Brian,"Apple is working with medical professionals to see if Apple Watches can detect heart problems. Here's how it works. If the Apple Watch doesn't fit around your wrist, you have a heart problem."
Conan O'Brian,"In a sewer in London, officials found a giant clump of fat, waste, and diapers known as fatburg. It's massive. The fatburg is so repulsive officials are divided on whether to dissolve it or cast it as a dance mom."
Conan O'Brian,"In Palm Springs, California, a Starbucks barista saved a customer's life by giving him CPR. Isn't that incredible? Apparently the customer had a heart attack when the barista spelled his name right."
