name,monologue
Conan O'Brian,"Bill O’Reilly revealed that he is mad at God for putting him through his sexual harassment scandal. Today, God refused to comment; instead, she just laughed."
Conan O'Brian,"President Trump and Republican Sen. Bob Corker are in a feud after Corker compared the White House to a day care center. When they heard this, 3-year-olds everywhere said, “Oh no — do not lump us in with that guy.”"
Conan O'Brian,"The average ticket for tonight’s Dodgers-Astros World Series game is about $3,000. Isn’t that crazy? For that kind of money, you could see half of “Hamilton.”"
Conan O'Brian,"The opening game of the World Series is here in Los Angeles and it’s 104 degrees outside. So, think of this: While none of us are at the World Series, at least we have air conditioning."
Conan O'Brian,"A California elementary school is under fire for putting up a Donald Trump scarecrow. Even worse, 30 percent of the crows still think the Trump scarecrow is doing a great job."
Conan O'Brian,"Foreign policy experts say that the president of China is now the world’s most powerful person. As you can imagine, that came as quite a shock to Beyoncé."
Conan O'Brian,Nickelodeon has fired a male producer after multiple accusations of sexual harassment. He’s the creator of Nickelodeon’s “SpongeBob No-Pants.”
