name,monologue
Conan O'Brian,"In an impromptu press conference, President Trump said, ""The hate and the division must stop."" For a minute, the crowd got excited, because they thought Trump was resigning."
Conan O'Brian,"In the press conference, President Trump said that Steve Bannon was a good friend and not a racist. Then he said, ""Oops, I meant to say, 'a good racist, and not a friend.'"""
Conan O'Brian,"In his press conference, President Trump referred to the neo-Nazis as ""history buffs."" Then he referred to serial killers as ""population control experts."""
Conan O'Brian,"Google has banned the neo-Nazi website The Daily Stormer from its site. So now if you want to search for hate groups on the Internet, you’re completely out of luck!"
Conan O'Brian,A Florida man who accidentally fired a gun in a strip club restroom while trying to take a selfie has been sent to prison. The weird thing is everyone else at the Florida prison is there for the exact same reason.
