name,monologue
Jimmy Fallon,"Big news out of Washington on Friday – White House Press Secretary Sean Spicer officially resigned. That’s right, Spicer said that all the greats always know when to leave on top."
Jimmy Fallon,"Over the weekend, new White House Communications Director Anthony Scaramucci deleted a bunch of old tweets that were critical of Trump’s platform. Trump was shocked — he said, “You can delete tweets??”"
Jimmy Fallon,"I saw that WebMD is being sold for $2.8 billion. The owner said he was just getting tired — but WebMD says it could either be gout, polio, or scurvy."
Jimmy Fallon,"That’s right, WebMD is being sold. No word on who bought it, but let’s just say the Republicans finally found a replacement for Obamacare."
Jimmy Fallon,"I read that you can now buy a new, wine-flavored jelly. Which is a great idea until your kid’s teacher calls and says, “I dunno what happened to Billy. He ate a PB&J and keeps singing ‘Don’t Stop Believing.’”"
Jimmy Fallon,"Today is National Cousins Day. And if you’re from West Virginia, happy anniversary!"
