name,monologue
Conan O'Brian,Vladimir Putin announced he’s running for reelection as president of Russia. Putin’s campaign slogan is “I Made America Great Again.”
Conan O'Brian,"During a speech on TV yesterday, President Trump was heard slurring. Trump denied it, saying, “I save all my slurs for Muslims.”"
Conan O'Brian,"First lady Melania Trump and second lady Karen Pence visited Texas. Melania was overheard saying, “We’re near the border, let’s make a run for it.”"
Conan O'Brian,"Ireland will be collecting $15 billion from Apple in a settlement over back taxes. Ireland will receive the money on Friday, and Guinness will have it all by Monday."
Conan O'Brian,"A New York woman is suing her surgeon claiming he was on his cell phone during her operation. In response, the doctor said, “For your information, I was Googling ‘how to perform surgery.’”"
Conan O'Brian,"Amazon is now making it possible to create a shopping profile for your cat. Yeah, all you have to do is go to Amazon and type in “I am single.”"
