name,monologue
Conan O'Brian,"It's being reported that Veterans Administration nominee Dr. Ronny Jackson is known as ""the candy man"" in the White House because he gave out prescriptions ""like candy."" So, now we can all stop asking ourselves, ""How does Melania do it?"""
Conan O'Brian,"French President Macron told Congress he disagrees with President Trump on the Iran nuclear deal and climate change. Macron said, ""But other than things that could destroy the entire world, we're on the same page!"""
Conan O'Brian,"Kanye West tweeted a lot of praise for President Trump. Kanye called Trump ""my brother,"" and Trump called Kanye ""my one black supporter."""
Conan O'Brian,"Bookmakers are giving odds on the royal baby's new name and the name that came in dead last is ""Wayne."" Which is too bad, because I’d love to hear the Royal Guards say, ""Please rise for his royal highness, Lil Wayne."""
Conan O'Brian,Body language experts say all the touching between Presidents Trump and Macron was an exercise in primate-like male dominance. And here's the good news for Americans — apparently our baboon won.
