name,monologue
John Oliver,"I was talking about a different little bitch, in a completely different room. If I was talking about that little bitch, she’d know about it. Why are you booing me?” Look, Toronto: I think I speak on behalf of the rest of the world when I deliver you this message. Please, elect this man! Sure, his brother was fun, but at a certain point, we felt bad laughing at him. Whereas Doug Ford doesn’t have a drug problem, he’s just an asshole. A non-chemically-assisted asshole. So please, Toronto, I beg you! Let us laugh at your asshole for another four years. Yours sincerely, everyone who does not live in Toronto. Thanks so much for watching, we’ll be back next week, good night."
John Oliver,"Some chimps can actually roll their tongue, can you? Some people can. You’re one you can’t."
John Oliver,What does that mean?
John Oliver,What’s wrong with me?
John Oliver,Or what’s wrong with me? Let’s put it that way.
Main Segment,"Sugar Other segments: Premiere of Ontario Doug Ford, Jr. Guest: Primatologist Jane Goodall"
