name,monologue
Kimberly Guilfoyle,Ladies and gentlemen! Leaders and fighters for freedom and liberty and the American dream! The best! Is yet! To come!
Jason Joyce,"If Biden wins, he’ll be controlled by the environmental extremists."
Natalie Harp,We’d be one step closer to government-run healthcare.
Eric Trump,Biden has pledged to defund the police.
Donald Trump,"And he’s even talking about taking the wall down, how about that?"
Larry Kudlow,"Then, came a once-in-100-year pandemic. It was awful. Health and economic impacts were tragic. Hardship and heartbreak were everywhere. But presidential leadership came swiftly and effectively, with an extraordinary rescue for health and safety to successfully fight the Covid virus."
Nikki Haley,"After that horrific tragedy, we didn’t turn against each other. We came together, black and white, democrat and republican. Together, we made the hard choices needed to heal, and removed a divisive symbol peacefully and respectfully."
Mike Pence,The American people know we don’t have to choose between supporting law enforcement and standing with our African-American neighbors.
Mark Mccloskey,"It seems as if the democrats no longer view the government’s job as protecting honest citizens from criminals, but rather protecting criminals from honest citizens."
Patricia Mccloskey,"They’re not satisfied with spreading the chaos and violence into our communities. They want to abolish the suburbs all together by ending single-family home zoning. This forced rezoning would bring crime, lawlessness, and low-quality apartments into now-thriving suburban neighborhoods. So make no mistake. No matter where you live, your family will not be safe in the radical democrats’ America."
Tucker Carlson,So are we really surprised that looting and arson accelerated to murder? How shocked are we that 17-year-olds with rifles decided they had to maintain order when no one else would?
Cbs Evening News,"Alleged gunman Kyle Rittenhouse walking away, gun in tow, as people screamed that he just shot protesters. One law enforcement officer, seeming to ask Rittenhouse if anyone was hurt. Two incidents, two videos, with some asking why two different responses."
Chief Daniel Miskinis,"Everybody involved was out after the curfew. I’m not going to make a great deal of it. But the point is, the curfew’s in place to protect. Had persons not been out involved, in violation of that, perhaps the situation that that unfolded would not have happened."
Sheriff David Beth,"Let’s put them in jail. Let’s — let’s stop them from truly — at least some of these males going out and getting ten other women pregnant and having small children. Let’s put them away. At some point, we have to stop being politically correct."
Sheriff David Beth,"If there’s a threshold that they cross, these people have to be warehoused. No recreational time in the jails, we put them away. And maybe we’ve got to do is build warehouses that, after this generation is gone, they’ve perished in these buildings, we can turn them into something else. Maybe it’ll be malls. Maybe, maybe Amazon will buy ’em as — as warehouses later. But at some point, we have to get rid of this group of people– we have to lock them up. I don’t think I’m saying anything different than most people in society aren’t thinking, but they’re afraid to say it and I’m just to the point that I’m — I’m saying it."
Doc Rivers,"What stands out to me is just — just watching the republican convention, and they’re — they’re spewing this fear. Right? Like, all you hear is Donald Trump and all of them talking about fear. We’re the ones getting killed. We’re the ones getting shot. We’re the ones that — we’re denied to live in certain communities. We’ve been hung. We’ve been shot. And all you do is keep hearing about fear. It’s — it’s amazing to me why we keep loving this country and this country does not love us back."
Jared Kushner,"Look, I think that the NBA players are very fortunate that they have the financial position where they’re able to take a night off from work without having to — to have the consequences to themselves financially. So they have that luxury, which is great."
Letetra Widman,I’m not sad. I’m not sorry. I’m angry. And I’m tired. I haven’t cried one time. I stopped crying years ago. I am numb. I have been watching police murder people that look like me for years. I’m not sad. I don’t want your pity. I want change.
Announcer,And now… The RNC gets off to a great start.
Mayor Mark Boughton,"Our video is in jest. We’re not really gonna name the sewer plant after John Oliver. However, he still is full of [bleep], so I’ll stick by that."
