name,monologue
John Oliver,"[John] Putting aside the wildly divergent definitions we have of “stamina, charisma, and drive,” that “get out” garden party guest is right when she says Donald Trump is here to stay — although not in office, however hard he resists going. As a Biden campaign spokesperson told the press this week, “the united states government is perfectly capable of escorting trespassers out of the white house.” Which is just a nice sentence to hear. And there is going to be time to talk about what Trumpism is going to mean going forward, just as there’s going to be time to talk about what this week means for the democratic party, which didn’t get everything they hoped for. They lost seats in the house, and the question of whether or not they’ll have a senate majority is down to two runoff elections in Georgia in January. But the real takeaway of this election is that there’s no easy answer to the question of who we are. A perfect example is this: Kamala Harris is now going to be vice president. The first woman vice president, the first south Asian American vice president, the first black vice president, and the second black person we’ve sent to the white house in the last 12 years. That’s incredible. Unfortunately, we did elect a white supremacist in between them. And the fact is that all of that together is kind of who we are. We’re the country that did all those things. And it’s important not to deny that reality. And just a final quick point here: defeating Trump took a lot of work, much of it by activist groups led by those with the most to lose from a second Trump term. A big factor in the vote in Arizona was indigenous and Latino people coming out for Biden. And in Pennsylvania, Michigan, and Georgia, black voters were absolutely key, with the groups organizing that vote, particularly black women, working relentlessly for years. And in the days and weeks ahead, there’s likely to be a lot of talk from white people about how black and brown voters “saved us,” which kind of misses the point a little bit, because they weren’t so much voting as a favor for white people so much as voting to protect themselves and their communities from someone trying to do them active harm. Although there are some lessons in some of that organizing. In Georgia, Stacey Abrams, along with many others, helped to register hundreds of thousands of new voters over the past two years — half of them people of color — and turn them out to the polls. In fact, just before the presidential race was called, she was already tweeting out details about the January 5 runoff for senate and making sure people request their ballots. Why? Because she knows what she’s fucking doing. And if the democrats are smart — which they aren’t always — they should listen to her and activists like her going forward. Look, it’s going to be a long road to dig us out of the place that the last four years have put us in, but that’s why it’s so important to remember the moments of triumph this week has provided. Ritchie Torres and Mondaire Jones became the first gay black men elected to congress. Cori bush, a black lives matter activist, is Missouri’s first black congresswoman. In delaware, sarah mcbride became the country’s first openly transgender state senator. Multiple counties elected reform-minded prosecutors and sheriffs. Florida voted to increase the minimum wage, and every state that had a marijuana initiative on the ballot approved it. And most importantly, despite his lies, his obstructions, and his depressingly popular racism, this guy fucking lost. Do you realize what that means? One, he’s sad right now — which is great. But also, no more Stephen Miller at the white house. No more Steve Mnuchin — hate to see him go, love to watch him walk away. No more helicopter shouting time. I’m not going to miss that. No more Mike Pence or Betsy Devos or Jared. No more fucking Jared. And there’ll be big systemic, institutional problems we need to talk about in the months and the years to come — and we will, because for some reason, this is the life I’ve chosen. But for now, after what’s just happened, I frankly think we’ve all earned the right to put on our masks, go outside, and party like octopuses on fucking ecstasy. And now, this."
John Oliver,"There have been no hiccups, so to speak about just waiting for that big dump."
John Oliver,On cue to getting what should be a pretty big dump.
John Oliver,"We’ve got a dump, laura, it 0 east coast time."
John Oliver,So far the first dump your look pretty good.
John Oliver,"And slower we anticipated, we expected a big dumb."
John Oliver,We should point out it’s not going to be one dumb.
John Oliver,"About 9:30, we are going to get a big dump."
John Oliver,I was told we were going to get this one giant dump in the walk you. That’s going to be a huge dump.
John Oliver,Donald Trump got a little bit of benefit of that last dump.
John Oliver,"[John] That’s our show, thank you so much for watching. See you next week. Good night. ♪ ♪"
Main Segment,2020 United States elections Other segments:
Announcer,"and now, at the end of a long, exhausting week, it dumps."
