name,monologue
John Oliver,"Last Week Tonight with John Oliver Season 8 Episode 13 Aired on May 23, 2021"
John Oliver,"Hi there. Welcome to the show, still coming to you from this blank void. Which has started to feel a bit like home. And to be honest, it is pretty similar to England in that it’s frustratingly white, immediately depressing, and I want to get out of it as quickly as possible. Look, it’s been another busy week. Cher turned 75, the house voted to create an independent no commission to investigate the capitol assault, and the Supreme Court did this:"
John Oliver,The supreme court says it will take up the most direct challenge to Roe vs. Wade in a generation this fall. No
John Oliver,"At issue, a Mississippi law that would ban almost all no abortions after 15 weeks of pregnancy. It’s similar to bans recently passed in other conservative leaning states, all designed to get the newly conservative supreme court to confront no roe vs. Wade head on."
John Oliver,"Yup! The thing conservatives have been trying to do for decades now is finally happening. Rolling back abortion rights is pretty much the reason the country had to watch a human beer bong scream and cry during a job interview, the reason everyone freaked out when an 87-year-old woman died, and the reason why the president and half his inner circle all got Covid in the rose garden — wasn’t that a fun couple of days? All of that was building up to this depressingly significant moment. And states have been pushing the envelope hard when it comes to limiting abortion. With the latest attempt coming just this week in Texas."
John Oliver,"Texas has just adopted one of the most restrictive anti-abortion laws in the nation. Republican governor Greg Abbott signed the bill yesterday. It bans the procedure as early as six weeks into a pregnancy, before many women even know they’re pregnant."
John Oliver,"Well, that’s infuriating. And made somehow even worse by the fact they seemed to cram the few women in the room right behind Abbott and then let what can only be described as a Jos. A. Bank of men fill in everywhere else. You usually don’t see that many men in suits lined up to disappoint women unless it’s the first night of “the bachelorette.” And for many behind that bill, including one of its sponsors, state senator Charles Schwertner , restricting access to abortion has long been a priority. In 2017, he silenced a witness testifying against an earlier anti-abortion bill so hard, his gavel broke the glass tabletop of his desk. Take a look."
John Oliver,Sb415 inserts itself into the exam room by putting physicians in the unconscionable position of having to deny a woman the evidence-based compassionate care that results in the fewest complications. I want to remind you all —
John Oliver,"Especially the doctors on this committee, that a vote for this bill puts women’s lives —"
John Oliver,I urge you to stop playing with reproductive healthcare as if it’s your own political puppet. [Gavel smashes] Thank you.
John Oliver,"Wow. You know what they say. Women are too emotional to make decisions about their own bodies — best leave it to a level-headed, reasonable man who hulks out on his desk at work. Because just look at what that fucking Gavel did. In every way, that is the exact opposite of what is meant by “breaking the glass ceiling.” And there will clearly be much more to say on this story as it unfolds, but for now, let’s try and take a look at news that isn’t actively depressing. And here’s one — in Philadelphia, Larry Krasner , the reform D.A., won a hotly contested primary and Krasner’s victory was by no means assured — the police union backed his opponent in the primary, and he’s come under attack for bold reforms like vowing to never pursue a death sentence, reduce the number of people sent to prison by seeking alternatives to incarceration, and to stop illegal stop-and-frisk, reform cash bail, and end the abuse of civil asset forfeiture. Which is a striking set of promises, especially coming from a guy whose face-sweater combo whispers, “I’ve got audiobooks on vinyl.” Now, Krasner still has to face a republican in the general election. Specifically, this man, Charles Peruto . Who is a lot. His platform is the antithesis of Krasner’s. And he’s said, “my first line of business is to meet with every police captain. I want to have my wife cook them dinner,” while also releasing this video:"
John Oliver,"I was born and raised in west Philadelphia, 64th and Jefferson. I was born in a mixed neighborhood. I loved it. Ironically enough, the kid I hung out with every day was Michael Jackson. He didn’t sing but he played hoops. I understand black people just about as well as a black person, not gonna say — I’m not gonna say equal, but pretty good."
John Oliver,"Okay. That guy, sitting in that office, saying he understands black people as well as any black person isn’t great. Even if he does slightly walk it back by saying, “I’m not gonna say equal, but pretty good” — a level of nuance not seen since Plessy vs. Ferguson. The whole video is 35 minutes long, and shot in a single take, with real “no one in my family wants to listen to me anymore so they showed me how to use a webcam” energy. And look, Peruto is unlikely to win. But he does speak to the post-Trump trend where extreme cartoonishness isn’t a deal breaker for candidates — it’s a selling point. Take Missouri’s Mark McCloskey , who you might remember as the man who pointed a gun at black lives matter protesters while somehow making a polo shirt slutty. Well, this week, he declared his candidacy for senate with this ad:"
John Oliver,"When the angry mob came to destroy my house and kill my family, I took a stand against them. Now I’m asking for the privilege to take that stand for all of us. I will never back down."
John Oliver,"Okay. Setting aside the fact McCloskey looks like what you’d get if Sean Hannity fucked a packing peanut — “when the mob came to destroy my house and my family?” Get over yourself! Those were protesters walking past your yard on their way to the mayor’s house. No one cared about you until you started waving guns in their face. And side note: if there are nationwide protests against racism and your first response is “they’re coming for me!” Maybe think about what that says about you. And I’d say McCloskey’s was the most ridiculous campaign announcement this week, were it not for the fact that Andrew Giuliani — son of Rudy — is now running for governor of New York. And even Fox News pointed out, he’s doing so on the thinnest possible resume."
John Oliver,"One of the things that’s being asked about you is if you have the experience to take on the job of governor. You worked at the trump white house for four years, and were a professional golfer before that."
John Oliver,"The truth is, Martha, from an experience perspective, I may be 35 years old, but you gotta remember, I spent 32 years — parts of 32 years — in politics and in government. I’m the only announced candidate that actually has spent parts of five decades in politics. So I may look young, but I certainly feel a lot older."
John Oliver,"Okay. There is a lot to take apart and put back together there. One — do you think you look young? Because if I had to guess your age, I’d put you somewhere between “unhealthy 45” and “lying about an early retirement to avoid a sexual harassment settlement becoming public.” Also, why would you claim to have been in politics since you were three years old? Unless you’re counting being violently held by your father during his failed 1989 mayoral campaign while dressed as business chucky. Are you counting that? And even calling Giuliani a “professional golfer” needs more context, because his career highlights include being kicked off the Duke golf team for bad behavior like allegedly throwing an apple into another player’s face so hard, the apple exploded, and then appearing on a golf-themed reality competition called “The Big Break,” where he was clearly typecast as “the annoying one."
John Oliver,"Andrew Giuliani, he’s talky. That’s all he does. I mean, he just — you know, kind of talking everyone up, and you know, being Andrew pretty much."
John Oliver,Nice ball there. Did that hit the tree? Did that hit the tree? That’s impressive.
John Oliver,"I know a few guys were getting irritated, including myself."
John Oliver,That’s a tree! You’re telling me that’s not a tree right there?
John Oliver,"I mean, he would talk to this — to this — to this door if it had ears."
John Oliver,"He knows he talks too much, and we all tell him he does but, it almost makes him — I feel like he wants to talk more."
John Oliver,"Andrew Giuliani is a nightmare. Imagine being the worst person on a golf reality show. And it’s hard to imagine Giuliani winning the support of the entire state of New York when it seems he can’t even win the support of all of these future absentee fathers. In other words, his base. And yes, Andrew Giuliani’s ridiculous. All these candidates are ridiculous. But if the last few years have taught us anything, it’s that ridiculous people can end up getting elected. Just three years ago, we did a piece on state attorneys general — and in it, we highlighted Angela Paxton , the wife of Texas’s A.G."
John Oliver,"Just listen to his wife, proudly describing Paxton’s love for lawsuits in what apparently I legally have to call “a song."
John Oliver,"♪ I’m a pistol packin’ mama ♪ ♪ and my husband sues Obama ♪ ♪ I’m a pistol packin’ mama, ♪ ♪ yes, I am ♪"
John Oliver,"A few things you can glean from that clip: that woman has a gun, a litigious husband, and no future in music whatsoever. And I have somehow aged 30 years since 2018. A truly uncomfortable watch for many reasons. But not long after that segment aired, Angela Paxton was elected to the Texas state senate. There she is standing behind governor Abbott this week as he signed Texas’s abortion bill. The point is, yes, these people look like clowns. They are clowns. But it’s important to remember that clowns, while funny, are also fucking terrifying. And this week gave us another reminder that, if you’re not very careful, you can wind up with a clown car full of them making incredibly important decisions about your life. And now, this."
John Oliver,"Now it is time for public comment. Are there any members of the public who would like to address this board? Please, no, step forward."
John Oliver,[Speaking non-English language] cheerios. “Good morning America.” “The view.
John Oliver,What I see here are a number of representatives who worship lucifer.
John Oliver,Tobacco is great at getting bedbugs away from her bed. People don’t realize that.
John Oliver,♪ Board of supervisors ♪ ♪ some of y’all are a bunch of liars ♪
John Oliver,"Feel bad for the district, no soup for you."
John Oliver,♪ I started talking and tailored to seeing ♪ ♪ said the king to the people of san Francisco ♪ ♪ everywhere ♪ ♪ America’s cup boating ♪
John Oliver,"Thank you, sir. Thank you, Mr. Paulson. Next speaker, please."
John Oliver,"Moving on. Our main story tonight concerns local news . The trusted place people go to find traffic, weather, and here in New York, the single greatest 10 seconds of television this city has ever produced."
John Oliver,"At 11:00, paying more at the grocer but getting less, we’ll tell you how to get the most! The fuck are you doing?"
John Oliver,"Perfect. Absolutely perfect. That is Sue Simmons , by the way. She sadly retired in 2012, and has been missed every day since. Because if any city needs a news anchor with an ability to say “the fuck are you doing?,” It is New York. We’ve talked about local news a lot on this show — particularly, regarding just how important it is to any community. We are constantly featuring local news investigations in our stories. And it isn’t just important in a civic sense; it’s a major moneymaker for stations. Nexstar, one of the biggest owners of local stations, said they earned nearly half their advertising revenue from spots aired during local news programming. But the need to both inform a community and make money has always been tricky to reconcile — as you can tell from this 1960s clip of Baltimore’s Channel 11 news."
John Oliver,"In Chicago, today, a white mob threw rocks and bottles at civil rights demonstrators. That story after this message about mash’s ham."
John Oliver,"He’s a lover. No, not the kind you’re thinking of. He’s a ham lover. And all ham lovers know that mash’s hams are the best you can buy."
John Oliver,"Okay, that is a very awkward transition to have to make. To go from teasing a story about a racist mob with a Mash’s ham logo on your desk, to a man who is — no matter what he says — definitely fucking that ham. Which is absurd. Why would you do that, when instead, you could be fucking Honeysuckle white’s fresh ground turkey? The only ground turkey that’s 93% lean and 100% fuckable. Get your fuck fill with Honeysuckle. Now, clearly, maintaining journalistic independence from advertisers is critically important. So important, in fact, it’s frequently referred to as the “church-state wall.” And the FCC has rules requiring broadcast stations to announce when content has been sponsored or paid for in any way. Unfortunately, many local stations have either completely broken those rules, or violated the spirit of them, through a practice known as “sponsored content.” It’s where advertising is blended directly into the broadcasts, and it’s both more widespread, and harder to detect, than you might realize. So tonight, let’s talk about sponsored content . And let’s start with the stuff that seems essentially harmless: people getting paid to hawk products on tv. There’s an industry of lifestyle experts that do this. Here is one of them explaining the process to potential clients."
John Oliver,"Brandigration is where a brand, its product, and the messaging are all worked together within the content of a show in a pre-planned manner. With so many shows offering integrated content, it can be hard to choose. But let’s start with local, okay? We have a method that helps me get interviews in a snap."
John Oliver,"See? In an instant, we have access to shows across the nation that are ready for your content."
John Oliver,"Wow. I gotta say, that is pretty impressive. The only person I can summon with a snap of my fingers is George Clooney. Watch. There he is."
John Oliver,"Hey, George! How are you doing?"
John Oliver,Uhhh… I’m doing fine. What are you doing?
John Oliver,I’m just showing people how I can summon you with a simple snap of my fingers.
John Oliver,"I’m eating dinner. I gave you this power to use in a limited capacity, John."
John Oliver,"Understood, George. Bye!"
John Oliver,"see? The system works! But the truth is, Michelle didn’t just have the power to make people appear out of thin air. She also, crucially, had the power to make them play along as she hawked horrifying products like these."
John Oliver,"These are the new French’s crispy jalapenos. One fun idea is to use it in this jalapeno cheeseburger dip. This is seriously everything you love about a cheeseburger in dip form. Take a look, is this thing gorgeous or what? This thing has just hit the party scene. It’s the Velvetta shells and cheese life size liquid gold fountain."
John Oliver,"Okay, so, a few things I love are Doritos, melted cheese sticks, and nachos, and now there’s a way you can enjoy them all in one. These are Doritos loaded. It is a totally new way to experience Doritos."
John Oliver,That’s a really fun twist on a snack idea.
John Oliver,"no! No, it isn’t! Now that product has since been discontinued. Probably because it looks less like a snack, and more like someone deep-fried a fidget spinner. And you probably assumed michelle was getting paid to do that. But interestingly, the station was also getting paid to have her on. And while the fcc requires sponsored content like that to be labeled, it has no requirements for exactly how or for how long. So for instance, in the case of doritos loaded, the disclosure came at the very end of the segment for just two seconds. So six seconds total. Which is, incidentally, about the same amount of time doritos loaded stay in your body before being forcibly ejected from whatever orifice they’re closest to. This practice can be so lucrative that many big chains have now set up templates for local shows, built around sponsored content. Scripps has “morning blend,” tegna has “great day,” nexstar has “daytime,” and sinclair has, I can only assume, “the muslims attack at dawn.” And it’s not just brand experts joining by satellite. Sometimes local businesses will pay for an interview, where they can script the questions, and make sure they’re presented glowingly. Take jim heafner. Until recently, he was a financial adviser in charlotte, north carolina, who was on the local show “morning break” all the time, and was always introduced in very positive terms."
John Oliver,"We have jim heafner, he is a certified financial planner, the president and ceo of heafner financial, a best-selling author, just an all-around great guy. Thank you so much for being back here. You’re a regular here."
John Oliver,Thank you so much for being back with us.
John Oliver,We’re so glad to have you back because you’re gonna help our folks get financially fit.
John Oliver,"Welcome back, mr. Heafner! We love when you are here with us, sir."
John Oliver,"that level of enthusiastic cosigning seems pretty convincing until you remind yourself, the station was being paid to say those things about him. It’s the reason no one who gets a birthday cameo from gary busey thinks, “wow, gary busey hopes I make it to 156 years old? He must be my best friend.” Instead, they think, “wow, craig just wasted $350 getting gary busey to wish me a happy birthday. He must be my best friend.” And it’s worth noting that heafner and the firm he worked not only were ordered to play $1 million in an arbitration case that he lost retirees’ money come about 22 clayton’s recently seeking damages related to sued him, the loss of $2.7 million of their investments, with one of them even saying he trusted heafner because he “believed the longest-running charlotte station would invite on trusted experts.” And yeah! Of course you’d believe that! People trust their local station! That’s the point here! And it doesn’t stop at these local lifestyle shows — companies have also bought their way directly into local news broadcasts. Back in 2017, sinclair faced a $13.3 million fine from the fcc over segments promoting the huntsman cancer institute, which were broadcast more than a thousand times on local sinclair stations with no indication whatsoever they were sponsored. Some of these segments aired during the evening news, and in hindsight, the tone of the reports were suspiciously upbeat."
John Oliver,This complex machine is eradicating cancer without the invasive procedures.
John Oliver,"For patients like jeff, this is welcome news."
John Oliver,"If you’re going to have prostate cancer, this is the time to have it."
John Oliver,"In salt lake city, utah, mark kobel reporting."
John Oliver,"that is a hell of a positive spin: no time like the present to have prostate cancer. What are you waiting for? And despite how he signed off, is mark kobel actually reporting there? Because, in retrospect, it seems more like mark kobel parroting the absurdly sunny cancer propaganda of his business daddy’s favorite money friend. But I will say this, at least that’s an instance of a broadcaster acting so egregiously, the fcc was able to take action. A lot of the time, stations are doing just enough disclosure to stay the right side of the fcc, but that doesn’t mean they’re not doing massive harm to their credibility. Because even when a sponsorship is properly disclosed, I’d argue there are certain businesses local stations should not be selling themselves out for. Especially when it comes to medicine. Because a surprising number of segments on these shows are enthusiastic, uncritical showcases for expensive treatments or devices, featuring claims that are, to put it charitably, medically dubious. Like this product, which made it onto a regular morning newscast in utah."
John Oliver,"Today, we’re talking about a technology aimed to help men with a serious issue. Stephanie and dustin wolff, the co-inventors of the world’s first clinically tested home use shock wave device to treat erectile dysfunction. It’s called the rocket."
John Oliver,"This is the rocket. So the rocket works on the principle of low-intensity sound wave therapy, which has actually been around in europe for about 25 years. It’s very effective. It’s safe. And it’s — the technology’s fda recognized."
John Oliver,"okay, first, that vibrating taint missile looks utterly terrifying. And while it’s since been rebranded from “the rocket” to “the phoenix,” I’m not sure “put this bird that destroys itself in fire near your penis” is much of an upgrade. But second: what does “fda recognized” even mean? It definitely doesn’t mean it’s “fda cleared,” much less “approved.” And the fda told us the phoenix is “registered” with them, as a therapeutic massager, though, not as a device to treat erectile dysfunction. And at this point, I legally have to tell you, the manufacturer of the phoenix says they make no explicit claims about treating e.d. Which is a little odd, because their own website claims that phoenix offers proven technology to make your penis harder,” which they and you can complete this treatment in your home. Which they presumably feel justifies its price tag of holy shit $879. But that is not the point here. The point is, if you’re going to allow that product into the body of your local newscast, you might want to have some very pointed questions ready, and not end the segment like this."
John Oliver,"And of course if you want to find more information, where can they find it online, guys?"
John Oliver,There you go. Get that help you need for whatever ailment you’ve got right here.
John Oliver,"yeah! Use the rocket for whatever ailment you’ve got! Especially if that ailment is having 879 too many dollars. And the thing is, that’s far from the only weird medical product that’s been presented uncritically during sponsored segments. Denver’s mile-high living featured a spa owner promoting this exciting new treatment:"
John Oliver,"Mona lisa touch is the first fda-cleared laser to treat the vagina, and in doing so, it treats the symptoms of vaginal atrophy."
John Oliver,"No. It’s — typically, what you’ll feel are mild vibrations. I tease, the next day you might feel like you have a sunburned vagina, but it’s just healing."
John Oliver,"oh, that’s okay, then. It’s just your typical, everyday, sunburned vagina. And only caused by a laser. So really, just your typical, everyday, laser-roasted genitalia. Which is just healing. From the laser you deliberately burned it with. It being the inside of your vagina. Your run-of-the-mill laser-charred vagina. And if using a laser as a medical pseudo-dildo seems like a scary thing to do: you have good instincts. Because over a year before that segment aired, the fda issued a safety alert, making it clear that they have not cleared or approved for marketing any energy-based devices to treat vaginal atrophy, and applying energy-based therapies to the vagina may lead to vaginal burns, scarring, and recurring or chronic pain. And the problem is, segments with dicey medical claims are just everywhere. Recently, the fda has warned about the use of unapproved stem cell therapies, which they say can be harmful. But you wouldn’t know that to watch some of these shows. Here’s a segment from “good morning texas,” featuring a doctor who’s been disciplined multiple times by the state medical board for separate issues, claiming his stem cell therapy can treat things like m.s. And parkinson’s, despite the fact that stem cells have never been approved to treat any neurological disorder. And it’s not just him — here’s a naturopathic doctor, making similarly baseless claims on a station in arizona."
John Oliver,"So, what kind of conditions are you treating with this?"
John Oliver,"So, we treat so many different kinds of conditions. We can do it to joints, we’ve been doing a lot of that — systemic things as well. Including, we’ve had a patient with chron’s disease recently. Had a patient with heart disease who was in severe heart failure. Both of them within a week of getting these stem cells are just feeling great and improved to almost normal."
John Oliver,"yeah, wow! Indeed! That card suggested he can treat parkinsons, alzheimers, autism, m.s. And als. It seems the only thing his stem cells can’t do is help that station proofread their list of “conditions can stem cell therapy benefit.” Because other than that, got you they covered have! And look, while there is no way of knowing exactly how many people are watching these shows as they air, that’s not really the point, as this marketing executive at nexstar explained to potential advertisers."
