name,monologue
John Oliver,"Now, here’s the deal. Most people think, “okay, so I go on the tv show, I’m on tv, great, this is awesome, and it airs at 4:00, I go on, great, and people see me, okay, so this is cool.” I’m gonna tell you right now, when you actually go on and do that, that isn’t even the cake. That’s just the icing. You know what the cake is? The video file. [Laughs] at the end, you’re gonna have a four or five minute video file. And you’re gonna do what with it? Post it everywhere! [Laughs]"
John Oliver,"okay, first of all: what is that motion? That is unnecessarily gross. This isn’t how you represent cake and icing. This is how you bring a mash’s ham to orgasm. You give it the ol’ wiggle and squeeze, and then a twist and a snap. Oh, shit!"
John Oliver,"sorry, George. I’m sorry. That one was genuinely an accident. I was just trying to show people how to bring a mash’s ham to orgasm."
John Oliver,"Oh. I guess that’s good information to have. The point is, that marketing executive is right. The cake is the video file, and companies will take that video and run with it. Remember that naturopathic doctor who claimed stem cells are a treatment for Alzheimer’s and autism? Here’s his website, which proudly features the many times he was given an uncritical platform on trusted local tv. And you might think viewers should be smart enough to approach anything on these shows with skepticism. The thing is, though, many of these stations also swap figures from their newsroom to their sponsored content shows. At abc4 Utah, for instance, surae chinn is both the channel’s chief medical correspondent and a host of the sponsored content show “good things Utah.” And it really does feel like a line is getting blurred there. And look, ideally, stations wouldn’t engage in this practice at all — or, at the very least, their disclosures would be harder for viewers to miss, and they’d do significantly more work to make sure that if they’re letting someone buy their way onto their channel, and present something as real, that it’s not, in fact, total nonsense. Because right now, it’s far too easy to make a ridiculous product that makes outlandish claims, and get it onto local tv. And the reason I know that is, we did. We started a company called Venus inventions, and created something called the venus veil. An absurd medical product based on technology that absolutely does not exist. We set up this website, and even hired an actress to brandigrate the shit out of the Venus veil, into shows it had no business being on. Did it work? I dunno — you tell me, ABC 4 Utah!"
John Oliver,"I’m so excited to talk with Erica Hernandez with the Venus veil, a revolutionary new product on the line. What exactly is it? I’m so intrigued."
John Oliver,I’m so glad you are intrigued. So this is the Venus veil. It is the world’s first sexual health blanket.
John Oliver,"Yep! That was on ABC 4 last Friday. And I’d love to tell you it was difficult to get it on, but it really wasn’t. And remember, that’s their chief medical correspondent. And it seems striking that she didn’t have any follow-ups on claims we made about the veil that you’d hope a medical correspondent would immediately take issue with."
John Oliver,"The veil is being designed with the hope that it will precisely draw out the natural alkaline undercurrents of the vagina, and initiate a low-grade state of what we call micro-death, which sounds incredibly scary, but that’s actually just restarting that area’s natural life cycle. It’s using this field of magneto-genetics I was talking about, and also a technology that’s been around for a really long time that was pioneered in Germany about 80 years ago. So this is full of cutting-edge technology, but it just looks like a blanket."
John Oliver,"Yeah! It does. And that’s because it is. It is just a blanket. Also, technology that was pioneered in Germany about 80 years ago? I would have some questions about that particular period in German history. And I know that looks bad. But let’s be fair here, it’s just an isolated example. There was no way another station was going to fall for this. Right? Absolutely no way. Is there, Kvue Austin? Because you wouldn’t have let us pay to directly follow your 10:00 pm local news this Thursday, would you? There’s no way that happened."
John Oliver,It includes some pretty interesting technology.
John Oliver,"Yes, it does. So the team behind the veil was inspired by the field of magneto-genetics. But basically, your blood is full of iron, but it’s dispersed in such a way it isn’t affected by normal magnets. So the idea behind the veil is with the right blend of proprietary magnetic fibers, you can create a self-contained magnetic field that restimulates blood flow and gets you feeling like your normal self again."
John Oliver,"Is it? Is it interesting? Or is that obvious bullshit that definitely shouldn’t have been on in the same hour as coverage of the cease-fire in the middle east, a shortage of lifeguards in local public pools, and an investigative piece on criminal justice and bail reform? One of these things is not like the others, and it’s definitely our nazi-era fuck blanket. But surely, if you saw this blanket in person, then, in a studio, you would know not to enthusiastically cosign on the completely baseless claims being made right in front of you. You’d protect your viewers from that happening, wouldn’t you, Denver’s “mile high living?"
John Oliver,"This is meant to treat sexual conditions, but a lot of people are embarrassed to talk about their sexual health, right? So it was designed to be something that’s really discrete and also really stylish so you can have it in your home and it really — I mean, could it look less like a medical product?"
John Oliver,"Yeah, no, it doesn’t look like that. You know, again, it’s one of those things I think a lot of people right now are looking to enhance their lives, but they also don’t want anything too invasive."
John Oliver,"So this is something where, again, you’re not needing a prescription or anything like that as well."
John Oliver,"Well, thank you, Erica. Thanks so much for coming in today. We appreciate it."
John Oliver,Thank you so much for having me. Thanks for making it so easy. This was great.
John Oliver,"Yeah! Super easy! You could even argue “way too easy.” Because the truth is, none of this was nearly difficult enough to get onto tv. And it wasn’t even expensive. That cost just $2800. This one cost $2650. And this one only cost $1750. It was all shockingly affordable, and sadly, on some stations, didn’t even look that out of place. And that is not good. Because, as we’ve said for years now, the integrity of local news is crucially important. And there is real harm for everyone if that integrity is damaged. So to the owners of these stations who are selling them out at a depressingly cheap price, I have a simple question. If I may quote the words of a very wise news anchor: the fuck are you doing? That’s our show. Thanks so much for watching. If you want to see our Venus veil segments in full — the whole cake, if you will — you can go to venusinventions.com. Good night!"
John Oliver,Are there any side effects of this at all?
John Oliver,You might feel a little bit of tingling but we liken it to what you might feel if you are standing over a really loud several of have a tight
Main Segment,Sponsored content Other segments: Roe v. Wade Guest: George Clooney
Announcer,and now… San Francisco city council meetings public comments are a joy to behold.
