name,monologue
John Oliver,"Oh, come on. There’s a pretty clear subtext to what they’re selling there. It’s like seeing a cheerful ad for “plastic tubs the size and shape of a human body.” This isn’t for anything in particular! There’s all sorts of human body-sized things you could put into one of these sturdy tubs! Also, they’re scream proof! “No matter how much sound something makes inside, you’ll never hear it!” We’re not telling you what to do with our product, though — we’re simply leading you to a very specific conclusion. Although, interestingly, despite the fact hackers now have the ability to make their financial transactions in secret, it’s not always that hard to figure out where, exactly, the money is going."
John Oliver,"[CNBC] This shows an alleged member of a Russian cyber gang known as Evil Corp, showing off an expensive Lamborghini in a parking garage. This is video of Evil Corp members allegedly doing donuts and obstructing traffic in downtown Moscow."
John Oliver,"[CBSEvening News] Videos and photographs released by investigators show the alleged hackers living large, posing with arms full of cash, and showing off a pet lion cub."
John Oliver,"[BBC World News] This is 32-year-old Maksim Yakubets with his Lamborghini Huracan and his personalized number plates, which in Russian reads “thief."
John Oliver,"wow. These guys are douches. It’s bad enough sitting in a traffic jam watching some asshole do donuts in the middle of the street without having to wonder if there’s a lion cub throwing up in the car. C’mon, guys. Leave lions out of this. If you absolutely have to have a weird animal, get a big snake. I could give two shits about a big snake’s quality of life. And you can tell any big snake I said that. But there’s actually a reason those hackers feel so comfortable driving around with license plates that are basically an admission of guilt, and that’s brings us to the final factor increasing ransomware attacks, and that’s countries providing safe havens . Because multiple governments — and Russia, in particular — will look the other way for hackers so long as they do their work outside of their borders. Cybersecurity experts say the “don’t work in .ru” stricture has become an unwritten rule in the Russian-speaking hacking community, to avoid entanglements with Russian law enforcement. Basically, Russian hackers know, as long as they don’t make trouble at home, they won’t be punished for what they do abroad. And when you put all of this together, with cybercriminals able to buy ransomware off the shelf, get paid in untraceable currency, and work free from state interference, is it any wonder we have such a massive problem on our hands? Which brings us to the key question — what can we do about this? Well, here’s a terrible idea."
John Oliver,"We ought to pass a law immediately that makes it — this kind of hacking subject to a death penalty, and the law should include a provision that the president, through a judicial process, should be able to order the killing of anybody overseas who is doing this."
John Oliver,"Wow. That’s both incredibly harsh and also endearingly naïve. Because I hate to break it to newt, but America doesn’t exactly concern itself with “a judicial process” to kill people overseas. We very much take the Santa Claus approach: see them when they’re sleeping, know when they’re awake, make a list of who’s been bad or good, and then kill some bad ones, and whichever good ones happen to be around them. You know, for goodness’ sake. So that is one extreme way to handle this. The current administration, however, has so far taken a different tack. In the wake of the colonial hack, this was the message they were publicly sending."
John Oliver,"[C-SPAN] We recognize that victims of cyberattacks often face a very difficult situation, and they have to just balance, often, the cost-benefit when they have no choice with regard to paying a ransom. Colonial is a private company, and we’ll defer information regarding their decision on paying a ransom to them."
John Oliver,"okay, so you’d like them to pay the ransom. You’d like the gas back, and the easiest way to get the gas back is to pay the ransom, so you’d like them to pay the ransom. It’s a pretty strong hint, and you get the feeling that if the hint doesn’t work, Joe Biden is going to take their computer and pay for them. If that Russian grandma can figure out how to use bitcoin, there’s a 30% chance joe can too. But there has to be a middle ground between “just kill them” and “just pay them.” Because most punishments — and this is true — fall somewhere between “death sentence” and “a cash reward.” And the problem is, the more we pay, the more these kinds of attacks will be encouraged, and the more well-funded they end up being. So much more needs to be done here — and I will say, on the government level, there are some encouraging signs. The Justice Department recently called a tax forced to curtail the proliferation of ransomware attacks, does feel a little late to be forming a task force but it is definitely better than never. Also the infrastructure bill a billion dollars for improving the cybersecurity of local governments. But the thing is, it’s not just up to the government to take cybersecurity a lot more seriously. Companies and private individuals have to step up, too. And there are some basic things that we should all absolutely be doing. First, set up multi-factor authentication — seriously, do it right now! Second, keep your computers up to date, and also, don’t click on suspicious emails. And I know that those measures sound small when we’re facing something so terrifying. But in a world where most people’s doors are unlocked and wide open, just locking your door might be a deterrent. The fact is, it’s in everyone’s interest to get this under control, because right now, it really, really isn’t. To the point that it may well be time for a new ad campaign to drill home just how vulnerable all of us are."
John Oliver,Have you ever lost access to your medical records?
John Oliver,"How to work out to make a bitcoin transfer just so you can see photos of your grandchildren again? Or send a fax from the beach? Like, want to do some kind of beach business? Have you ever open your laptop to see a clown’s face demanding $300,000?"
John Oliver,"You know what, all right. What the fuck is going on? What is happening?"
John Oliver,Or have butt plug and excitedly taken over by Ukrainian hackers.
John Oliver,"Unless we lost our taking the issue of ransomware a lot more seriously. So please, use two-factor authentication to secure all your medical records, emails, and butt plugs."
John Oliver,"If you think you can ignore this problem and will never be the victim of ransomware, trust us…"
John Oliver,That’s our show. Thanks so much for watching. We will see you next week. Good night.
Main Segment,"Ransomware Other segments: Delta variant spreading wildly around the country,"
Madison Cawthorn,"The greatest threat to our children today does not come from covid-19. It comes from woke, liberal government officials like you who think they are all knowing and all wise. [Cheers and applause] I’m a direct descendant of Abraham Kuykendall, one of the first men to settle this county. He knew hardship firsthand. He did not endure that hardship just so a woke school board can begin to systematically strip the responsibility from the hands of parents and guardians o to determine what to happens with their children."
Announcer,"and now… Pete Nelson from “Tree House Masters” really, really likes trees."
