name,monologue
John Oliver,"Wow. That is a pretty relaxed attitude given the circumstances. He’s talking about the nuclear-armed, saber-rattling superpower taunting his country with warplanes like it’s season two of “Emily in Paris.” “You know, I don’t love that it’s happening, but I just try to carry on with my life.” But the key question is, can the currently-safe status quo hold forever? Xi Jinping has stated that the question of Taiwan cannot simply be “passed on from generation to generation.” And those military drills seem to be sending a message. And while experts say war isn’t imminent, Taiwan is understandably thinking about its own defense capabilities. Something, by the way, we’ve been happy to assist them in thinking about, by selling them billions of dollars in weapons, showing even “strategic ambiguity” has its price. But despite U.S. assistance, the Taiwan military is obviously a fraction of China’s. And its recent attempts to attract recruits have left something to be desired."
John Oliver,The armed forces have been producing videos like this to try to drum up enthusiasm among potential young soldiers. But they’ve been struggling to make up for a shortfall left by a phasing out of conscription.
John Oliver,"Okay, I’m not sure that’s helping. That doesn’t look like a group of people who are excited to be in the military. It looks like a bunch of background dancers who were cut from “in the heights” because they were too boring to be on camera. So what exactly can or should be done here? Well, that’s something the entire world has been dissecting for half a century now, and so far the answer we seem to have settled on is some version of, “uh… Next question, please,” which is clearly not very satisfying. And I know ambiguity is inherently frustrating, especially for Americans, who might look at a place like Taiwan, which looks and acts like a country, and feel it’s weird and farcical to not acknowledge it as one. But from a practical standpoint, would that be better? And is that even what the people of Taiwan want? Could it be that maintaining the current, deeply weird, ambiguous status quo is actually the best option? I don’t know. I’m not Taiwanese, and frankly, people who aren’t Taiwanese making decisions for Taiwan is a bit fucking played out, historically. So maybe the best thing we can do is move past talking about Taiwan like it’s some kind of poker chip in a never-ending game of us vs. Them. Because the fact is, Taiwan is not a plucky bulwark against the red menace, nor is it some sort of island-sized Viagra to rejuvenate the Chinese nation. Taiwan is 23 million people, who, in the face of considerable odds, have built a free, democratic society, and very much deserve the right to decide their own future, in any way they deem fit, even if that means sporadically beating the absolute shit out of each other. And now this."
John Oliver,"And now, James Corden James Corden loves cinema."
John Oliver,"We have to congratulate you on your brilliant new movie, “happiest season.” It’s so good. For those who don’t know, tell them what it’s about and who you play. For anyone who doesn’t know, tell them what it’s about and who you play. For anyone who doesn’t know, tell them what it’s about and who you play. Tell them what it’s about and who you play. We have to congratulate you on your brilliant new movie. Brilliant new movie. For anyone who doesn’t know, tell them what it’s about and who you play. And who you play. Can you tell us what is foul and who you play? We have to congratulate you on your brilliant new movie, “fantasy island.” I’m really excited for this film for anyone who doesn’t know, tell them what it’s about and who you play. We have to congratulate you on your brilliant new movie. Brilliant new movie. Brilliant movie. We have to congratulate you, number one movie in the world. Tell them what it’s about and who you play."
John Oliver,That’s our show. Thanks so much for watching.
Main Segment,Political status of Taiwan Other segments: Police resignations due to COVID-19 related precautions
