name,monologue
John Oliver,"What we saw in the run up to 2018 was a lot of coverage of what was happening in Russia, a lot of coverage of rights abuses a lot of interest in that and a lot of engagement. I think what they noticed is how that vanished as soon as the first whistle blew. I think everyone became captivated by the football. The Qataris know if they can get to the first whistle they are over the line."
John Oliver,"It’s true, such as the power of the World Cup. Memories of controversy are likely to be washed away once it begins and incidentally, what a VIP box to be a part of there. Quick tip for the president of FIFA if you’re good to make arguments about how your organization is a global force for good maybe try not to sit between Mohammad Bin Salman and Vladimir Putin. You are the filling in a real shit sandwich there. [Laughter] That first whistle has now been blown. Qatar played Ecuador in the opening game of the tournament earlier today, so what now? Workers hope some of the athletes participating can help shine a light on all the exploitation that went into this event."
John Oliver,"My message — thousands of workers like me have worked on the stadium. We did not get our salary, our benefits. I hope if you talk about workers like us, maybe we will get what we are owed. I do not have much faith but still I have hope."
John Oliver,"That hope is pretty moving, especially given all the reasons not to have any. I really hope Messi hears that message, given though he plays Paris St. Germain a team owned by the state investment fund of Qatar at one hold your breath waiting for him to criticize them, people don’t openly shit on their employers unless of course it’s Warner Bros.-Discovery, they are to busily canceling shows the notice. Some players to their credit have been speaking out to. Harry Kane and other team captains have said they will wear one love armband and organizations from Australians national team to the international players union have issued statements condemning treatment of workers, women, and gay people. It’s not the players who are responsible for this mess, it’s FIFA. They put the World Cup in Qatar and everything that has happened since then has been a complete disgrace. I’m not saying you shouldn’t watch this World Cup or be excited about it. As tough as this is to admit, I will be watching. One of my greatest joys is sitting completely alone in my living room and cheering on England until they are inevitably knocked out in the quarterfinals on penalties. Let’s try to make sure a line is drawn here. In a few weeks’ time, the World Cup will be over. The final whistle will be blown on December 18th in the stadium that he built in a city that didn’t exist ten years ago and FIFA will happily move on. They will point to new human rights policies they have now adopted, we’ll see how truly committed to those they really are especially one of the suitors to host the 2030 cup is rumored to be Saudi Arabia which also uses the Kafala system that has a worse human rights record then Qatar. There is no reason to believe FIFA will ever do the right thing but I would love it if it could for just once in its shitty history find a way to hold itself to the lofty ideals that it has the gall to profess. I would love that as much as I love the World Cup itself and may be, just, even as much as David Beckham loves a taco. Because that would be perfection for me. And now, this."
John Oliver,"And now, people on tv interrogate the important question. Do you say pecan or pecan?"
John Oliver,It’s pecan. I will trust a southerner on this one.
John Oliver,Who wants to eat something called the pecan?
John Oliver,"I say thanks so much, now one of our good friends —"
John Oliver,"Moving on. Before we go, this is our final show of the year and frankly it has been a turbulent one from Britain having its shortest and weirdest serving prime minister ever to Roe v. Wade being overturned, to Russia’s war in Ukraine which lest we forget began back in February with the haunting sound of air raid sirens and was covered on CNN with this jarring moment. [Sirens] ♪ ♪ ♪ ♪"
John Oliver,Get five boneless wings for $1 with any handcrafted burger only at Applebee’s.
John Oliver,"The point is it has been a very weird year. Thankfully we did manage to have some fun. We produced a Subway sandwich Korean drama, we sent a polar bear to bet on an ice melting contest in Alaska, we blackmailed Congress with information we very much have and Nick Offerman blew up a trash can to make a point about elections. Our weirdest moment came when we discussed AI image generators because you may remember we learned people made a surprisingly large number of images of me with this generator alone featuring around 500 of them. We stumbled on a whole sequence of images that involved me falling in love with the cabbage and marrying it. Something we recreate it in person with Steve Buscemi presiding as the wedding officiant to. I married a cabbage this year and it was a beautiful day. I have a quick update because we checked that the generator see if more images will be made of me and it turns out that they very much have. A search for my name on there currently returns over 15,000 results. Let me be very clear, this has to stop. This shit is getting out of hand. Some users are continuing to speculate on my romantic exploits with images like John Oliver is now dating a carrot, while others have moved on like this one starting with the prompt two raccoons conducting an interview of John Oliver which produced this result. Kudos with going with my point of view in that situation. It seemed to be setting a new story in motion it begins with this prompt. John Oliver Yoon John Oliver Euna cycling towards a very steep mountainous hill which prompted this almost serene set of images. There was a development because the next images while unicycle line up a very steep mountainous hill, he realizes he can’t unicycle, doesn’t ever want to and not only is he afraid of heights, he literally has a crippling fear of unicycles as he tumbles down the hill in agony he says his trademark catchphrase “why do unicycles exist?” Which to be fair is a thing I say all the time to go there are a few images of a post-unicycle accident in the hospital until finally they type in the prompt after recovering from his unicycle accident he returns to his show what he does one of those wild John Oliver has HBO money stunts, I guess he ties together a hundred unicycles and pairs of two because that’s what nature intended to. Then there are like 50 clowns on stage writing the dangerous John Oliver by unicycles then he’s like that’s our show, see you next week. Picture in your mind right now what a spectacular image would be generated by the description of that. Do you have that image in your mind? Goods because this is the image the AI produced. Very cleverly focusing on the see you next week part of that prompt. Look how happy I look there! It is such a shame because the concept of chaotic clowns wobbling around dangerously on unicycles actually felt like a pretty decent metaphor that the year we just went through. It’s messy, idiotic, a little bit scary and it feels like someone didn’t fully think it through. It’s frustrating not being able to see that image for ourselves, isn’t it? … Is something someone might say if they didn’t have access to our production budget. To close out our season, here it is! A physical manifestation of the last year! Look at all these fucking clown clowns! Look at them, look at this other atrocity. Thank you so much for watching our show this year. We really appreciate it, thanks to our staff — stop honking. Thanks to our staff for working so hard to. Him I don’t like this at all this was a huge mistake."
John Oliver,"We will be back next February, please stay safe until then. Say it with me, why do unicycles exist? Classic phrase. Him see you year, good night!"
Main Segment,"2022 FIFA World Cup controversies (“FIFA III”) Other segments: Twitter under Elon Musk’s leadership, update on AI-generated art on Midjourney"
