name,monologue
John Oliver,"I genuinely don’t know what’s more annoying there, the fact that he answered a legitimate question with a prop, or that he apparently tells people no so often he needed a special button for it. Although between that, his talking Trump doll and his novelty desk sign, it’s slightly heartwarming to know that a spencer’s gifts in arizona is staying afloat thanks to the compulsive purchases of one supremely weird individual. But the thing is, quiet earp over there has openly told supporters in a fundraising email that, if he had been in power in 2020, “we would have won. Plain and simple.'” And in a debate, even brainstormed one scenario of how that could’ve happened."
John Oliver,"Knowing what we know today, there are certain counties that should have been set aside as irredeemably compromised. Maricopa county was one of them. Yuma county was one of them. We have so many votes outside of the law. That it begs the question, what do we do with an election where we have votes that are in the stream but should not be counted? If you can’t find the individual who is engaged in that behavior, perhaps that county has had a defective election."
John Oliver,"yeah — he just laid his plan out. Step one: identify two large counties which, if removed from the count, would hand the election to Trump. Step two: remove them from the count. Now, is that a conspiracy to steal the election? Well, as we now know, there are no conspiracies, but there are also no coincidences, in the famous words of one stephen kevin bannon. And here’s the thing: any one of the people you’ve seen so far would be bad in the wake of an election, but in combination, things could get “rough.” Because there “are protections against one rogue official refusing to sign off on an election. They could be sued, and if they refuse, they could be held in contempt of court. But experts warn that the ability of a governor or secretary of state to reject certification are significantly enhanced if others up and down the chain are of a similar mind. And to understand a potential worst-case scenario, let’s put some of the people you’ve seen tonight into a chain. Let’s start with partisan poll workers, inspired by steve bannon, deciding they’ve seen something fishy, and calling 9-1-1. They then kick their claims up to a county clerk like this guy — who’s maybe willing to amplify a perception that’s not a reality. That raises enough of a stink that people at the county board of canvassers or the state board refuse to sign off on the results. And then, the secretary of state takes their side — refusing to certify the results, or even arguing that the results from certain counties are so flawed that the county’s election has “failed”, and therefore can not be counted. In that scenario, experts say, a republican state legislature could point to supposed “irregularities in the conduct of the election, and choose their own slate of electors, to deliver a different result. And at this point, the law is a little fuzzy on what could happen next. Because, under the electoral count act of 1887, if the state sends two rival slates of electors and the house and senate disagree on which one is valid, the ones sent by the state’s governor gets counted. Which could be this person. Now, there would undoubtedly be lawsuits, and maybe the supreme court would step in, but also y’know, seeing as one of the justices has a wife who was part of the last attempted coup, maybe not. And I know this all sounds dramatic, and I don’t want to be too alarmist. I don’t mean to sound like chicken little here. I mean, I don’t mean to look like him either, but some things are out of our hands. Because the odds of Kari Lake unilaterally picking our next president are thankfully slim. But the odds of her, and others like her, being able to create a complete mess, are significantly higher. Because everything we’ve talked about tonight has the capacity to overwhelm our system, making it harder to certify elections quickly, leading to confusion, which sows doubt in the process, which in turn causes absolute chaos. Which is worrying, given that we’ve all seen what confused but motivated people are capable of doing when they think the process is broken. And we may not have to wait until 2024 to see that chaos unfold, as the midterms themselves are turning into a clusterfuck. Vigilantes are already turning up as unofficial poll watchers at voting drop boxes. Meanwhile, some very prominent voices on the right have been priming people to contest any result on tuesday that’s not a republican win."
John Oliver,"The democratic party has such contempt for voters and for democracy itself and so much confidence in its ownership of the media and of big tech that it no longer has to try to win your votes. They can even run mentally defective candidates who can barely speak and not only expect them to win but expect you to accept the outcome, no matter how transparently absurd it is."
John Oliver,"I get that Tucker Carlson is basically Cocomelon for bigots, but that’s gross even for him. From calling a stroke victim mentally defective, to putting “win” in heavy quotation marks — and for the record, one of the big clues that these conspiracy theories are bullshit is that so many of them are predicated on the belief that the democratic party is well-organized. Who on earth is stupid enough to buy that bullshit? So: what can we do here? Well, there are some obvious steps that we could take. On the federal level, we have to fix the electoral count act — the law whose vagueness allows for a lot of the fuckery I’ve just described. Both the house and the senate actually have bills that have bipartisan support and would, among other things, close the failed election loophole that might allow a partisan governor or state legislature to send whatever electors they choose."
John Oliver,"Mitch McConnell’s supported the senate version, so it actually might have a chance to pass. That’s the one piece of good news in this entire piece, so I suggest you savor it. But that’s clearly not enough. Long term, we still need comprehensive voting rights reform. Which is something we need to prioritize and fight for. But the first step, and I know this is going to be infuriating to hear, is for you to vote. We’ve talked a lot about how part of the reason Biden’s victory wasn’t stolen from him was thanks to the diligent work of a few people in key positions. But don’t forget the first part of why that was possible — a lot of people fucking voted. And I get how ludicrous it sounds for someone to say “fix the significant roadblocks keeping your vote from counting, by voting.” I hear it, I promise I do. Particularly if you’re a member of one of the many communities — like black voters, the disabled, the formerly incarcerated, and low-income communities — who’ve long been sounding the alarm about this shit. And voting’s not going to be enough on its own. At every level of the process, we need people to show the same level of enthusiasm for preserving our democracy that others are demonstrating for dismantling it. And I’m not saying it’s going to be easy to match the energy of people fueled by bullshit documentaries, flat-out lies, and the occasional exploding trashcan. But it is really important to try. And to that end, we have a message that we’d like you to hear."
John Oliver,"Hey, nick offerman here. Actor, author, woodworker, and a man who can actually pull off a short sleeve polo shirt without looking like my mommy picked it out for me. And this is a trash can. I’ve labeled it trash can because it is a trash can. I actually labeled it twice so there won’t be any mixups but obviously that’s unnecessary because we are all adults who do know the difference between a trash can and a goddamn damn voting machine. Republican extremists have been running their dry mouths claiming any election in which they receive less votes in the opposition must be rigged to. I’ve got some news for you. Actual patriots are sick and tired of shameless opportunistic charlatans who invent dangerous conspiracies, peddled mendacious propaganda, and worse sensor good, good dogs. If you are afraid to show a dog’s face, by god I’m not. There. Who’s a good boy? You can’t stop us from showing dogs just like you can’t stop us from voting. We are going to do it not because it’s fun, because it’s not really fun, but because it’s the right thing to do, america. And guess what? We are going to look at one fuck a lot better than you while we do it. One shot, cuts."
John Oliver,"Vote! That’s our show, thanks for watching — see you next week. Good night."
Main Segment,Election conspiracy theories and attempts to overturn the 2020 and 2022 United States elections Other segment: Acquisition of Twitter by Elon Musk Guest: Nick Offerman (as a parody of Mike Collins)
