name,monologue
John Oliver,"Okay, first, that is definitely the angriest I’ve ever seen anyone wearing a “rush” hat. [Laughter] And second, there is no doubt that man, at some point, has been kicked out of a youth soccer game. He just exudes “ref, I’d like a word” energy. I guarantee that is a man who has thrown a lawn chair, or at the very least, squeezed a kool-aid jammer so tight in his fists, the other parents thought his hand was covered in blood. Besides that, I will say, he seems like a cool guy. [Laughter] So that is what tenants can be up against. And the problem is, eviction filings can be on your record for years, jeopardizing your chance at future housing. Just watch as this woman contacts a realtor about a home that she’s interested in."
John Oliver,Did you get a chance to drive by and take a look at it?
John Oliver,"Yeah, I’m sitting in front of the home right now as we speak."
John Oliver,"Okay, Margaret. And how soon are you looking to move into a home?"
John Oliver,Are you on a lease where you’re living at right now?
John Oliver,"No, as a matter of fact, we’re not. We’re actually homeless."
John Oliver,"Okay, so where are you currently living?"
John Oliver,"Yeah, unfortunately, when we check the court records and see an eviction, unfortunately, we can’t help you."
John Oliver,"Look, there are some things that should probably stay on your record. Like war crimes, or voting for Taylor Hicks in the 2006 season of “American Idol.” [Laughter] You shouldn’t get to come back from that so easily. But people should have a chance to find safe and affordable housing, since the alternative is being homeless! And the thing is, you can be turned down for housing simply because an eviction case was filed against you, even if that case was later dropped, or indeed, you won it. The long-term damage that eviction filings do to your record is why many will choose not to fight when a landlord tries to kick them out. That’s one of the reasons people can wind up with a so-called “informal” eviction. That’s where their landlord does things like change the locks, threaten them, or even remove the front door. It is hard to measure just how many of these take place each year, but a survey of Milwaukee renters found that for every eviction executed through the judicial system, there are two others executed outside the court, without any form of due process. And given just how devastating evictions can be, it is infuriating to hear how some involved in the process view it. Remember that screaming rush fan from earlier? Well, it turns out, he actually has a little more to say."
John Oliver,"It’s sad to say, and some of you who are not landlords might be shocked to hear, we evict grandparents who are poor. We evict cancer-stricken people who are attending chemo. It’s sad, but what’s sadder is that somebody who purchases property for hundreds of thousands of dollars is given the finger by the law."
John Oliver,"Except it’s not sadder. [Laughter] It’s just not. On the great big list of sad things: person getting evicted during chemo is up there with dog deaths and the first ten minutes of “Up.” While landlord doesn’t get rent is at the very bottom, with celebrity tweets about a shitty airline experience and white guy not allowed to rap all the lyrics. It’s objectively not sad, at all. That is the core issue with rental housing in this country: people who think investments deserve more respect than basic human needs. And it has set up a system designed to ensure that some people just spiral downwards: they can’t move somewhere cheaper if nowhere cheaper exists. They can’t apply for federal assistance if there’s nowhere near enough. They can’t even use that assistance if no one accepts it. They can’t take their landlord to court if the court system is skewed against them. And they can’t depend on rental housing ever again if they’re evicted even just once. It’s a complete shit show. So what can we do about it? Well, there are some small things. We could pass rent-stabilization laws, and laws that prohibit discrimination against recipients of housing choice vouchers, and make it easier for landlords to accept them. We also could pass laws mandating the sealing of most eviction records, and give people a right to counsel in housing court. That alone can have massive impacts. In 2017, after sustained pressure, New York city became the first place in the country to give tenants the right to a lawyer in housing court. It is a major reason why, even before the pandemic moratoriums, residential evictions were down 40%. And luckily, other places are now following that lead. But I would argue what we really need to do is fundamentally change our mindset away from simply hoping that we can just tinker around the edges of housing policy and the private market will sort the rest of this shit out. Because we’ve tried that for decades, and yet, here we are. Instead, we need to agree: housing is a human right. And that is not actually just some empty slogan like subway’s “eat fresh”, or Gatorade’s “is it in you?” Which, looking back, was very, very weird. [Laughter] This can actually be policy. Many countries, including France, Scotland, and South Africa have legally codified a right to housing. And here in the U.S., 3/4 of Americans already believe that it is a human right. As for what that would mean, it would entail a massive federal investment in rental assistance, and the creation of much more affordable housing units across the board. And before anyone suggests we can’t afford that: we already subsidize certain people’s homes. The mortgage interest deduction gives massive subsidies to homeowners, by letting them deduct the interest that they pay on their mortgage on their taxes. That has cost the federal government more than $580 billion over the last decade. And currently, nearly 2/3 of the deduction’s benefits are going to those making $200,000 or more a year. I am benefiting from this program and I do not need to be! So we are clearly willing to prioritize housing in the budget, just not for the people who need it the most. The point here is, for a large portion of the population, simply having a place to live is an everyday battle. And for far too long, we’ve prioritized the protection of investments over individuals, and we’ve set up a system where landlords can “press rents and reset market rates,” and justify their actions with self-serving bible readings, even as they subject tenants to everything from tactical rat assaults to the incoherent rage of the single most foul-mouthed fan Ontario’s premiere prog rock power trio has ever fucking known. [Laughter] And now, this."
John Oliver,"I think you just look so great in it, Amy. It’s like casual but there’s an updated elegance to it, and of course, I had to stop by with wine because I missed you guys last week!"
John Oliver,"Tracy, thanks for swinging by and I will swing by and bring you some more wine later on."
John Oliver,"It’s just me, a few bottles of wine. I’m a mom and I enjoy a nice glass of my wine sometimes."
John Oliver,Literally took a sip of the wine. I just want that for the record. It’s not a prop.
John Oliver,We are going to bring in Jackie Stafford!
John Oliver,"And they said “wine?” And I said, uh, yeah!"
John Oliver,We have one in our teacups. We are having a tea party.
John Oliver,And we are going to go shopping for wine!
John Oliver,Let me bring my own bottle of wine and I will be here.
John Oliver,"It’s always a pleasure to be here. I think I lost my wine. Oh, you have your wine?"
John Oliver,I lost my wine for the hundredth time tonight.
John Oliver,"I have my college teachers, I have my Dave Matthews t-shirts that I love. Don’t get me started. [Singing]"
John Oliver,I’m number 41 all the way. We almost had Dave Matthews wine on QVC years ago. I think we should all go to his Instagram —
John Oliver,"That’s our show. Thank you for watching. These are my lines, and I love them, and I love to present them like this on my desk. See you, good night!"
Main Segment,Housing in the United States Other segment: United States House Select Committee on the January 6 Attack public hearings
Announcer,"And now, in honor of father’s day, zaddies."
Announcer,"And now, it’s always happy hour on QVC."
