name,monologue
John Oliver,"It’s tiring. I see a thousand ads running and you’re like, “Who do I vote for? What’s going on?” It is overwhelming because it then turns into, okay, so there’s pros and cons to this person and there’s pros and cons for this person. It’s turning out to where my generation doesn’t want to vote! [Laughter]"
John Oliver,"Wait. I’m going to choose to believe that woman is not the voice of her generation. Because that voice is, obviously, standing right beside her."
John Oliver,"What a shirt! I have so many questions, from “Why did no one at that local news station catch that?” to “Did he not realize he was wearing that shirt when the camera crew stopped him, or did he very much realize, and that’s the only reason he stopped?"
John Oliver,I’m not bullying that guy right now. I wouldn’t do that because… y’know.
John Oliver,"This election has been brutal. And while, who knows if they’re accurate or not, the polls in many swing states right now are basically tied. Which is absolutely mind-breaking for so many reasons, including last Sunday’s spectacle at Madison Square Garden, where incredibly racist things were said about Black people, Palestinians, and Puerto Ricans, with Trump trying to stem the damage with that last group by posting this on Tuesday."
John Oliver,"Oh, my god, I will vote. I will vote. For Donald Trump. Oh, my god, I will vote. I will vote. For Donald Trump."
John Oliver,"Yeah. He posted that without comment. And if it was meant as an apology to Puerto Ricans, it’s worth knowing: that’s a Cuban band. Though I admit, that’s a very catchy song, and I do appreciate that the lyrics are, “Oh my god, I will vote for Trump!” which sounds like someone realizing in real-time they’re an absolute dipshit."
John Oliver,"Trump’s closing argument has consisted of his usual fearmongering poison, interspersed with tweets like, “When I’m president the McDonald’s ice cream machines will work great again.” Which is both a very weird and a frustratingly funny thing for him to say."
John Oliver,"And that’s honestly been a real problem in trying to talk about Trump, ever since he rode down that fucking escalator. It’s been an issue for us at this show. Just last week we showed you this clip of him talking about immigrants:"
John Oliver,"They’re destroying the blood of our country. That’s what they’re doing. They’re destroying our country. They don’t like it when I said that, and I never read “Mein Kampf.” They said, “Oh, Hitler said that in a much different way."
John Oliver,"Here’s the thing, that is such a funny thing to say at the end there! It almost distracts you from what came before it. Because paraphrasing Mein Kampf is horrific. But pronouncing *Mein Kampf like a substitute teacher sounding out a student’s name during attendance is objectively funny. It shouldn’t be, but it is. And it’s yet another case of what’s ridiculous about Trump very effectively distracting from what makes him so dangerous."
John Oliver,"That may be one of the reasons Trump was able to become president in the first place, and why he might be about to do it again. This could come down to a handful of votes in a handful of states. And given that, I’ve been thinking, what am I going to be feeling on Wednesday? And is there anything I’m going to wish I’d said right now?"
John Oliver,So that’s what the rest of this is going to be.
John Oliver,"And look, for the past few months, we’ve talked a lot about Donald Trump and the danger he poses. We’ve admittedly talked less about Kamala Harris and her proposals. But that’s for a pretty clear reason. Picking apart policy proposals when the alternative is Trump is a bit like debating which color to paint the living room while your house is on fucking fire. You kind of have to prioritize the imminent threat."
John Oliver,"But real quick, while Harris’s platform is by no means everything I’d want, there’s stuff I like. Her proposal to expand Medicare so it covers long-term care and includes services like in-home aides would be transformative. And economists say her proposals would boost the income of the poorest Americans by 18%."
John Oliver,"As for abortion, she promises to protect and expand reproductive freedom, which is critical, especially as stories come to light of women literally dying thanks to abortion restrictions—just this week, we learned of a teenager in Texas who died after three ER visits, thanks to their abortion ban."
John Oliver,"As for Trump, we’ve talked about how, with Project 2025 , he’ll have a roadmap to bend the government to his will, how he’ll push the judiciary even further right, and that he’s promising a mass deportation program that’ll be even more destructive to immigrants’ lives than his first term was. What’s more, when RFK Jr. was running, we talked about how dangerous he could be, but Trump’s now promising to put him in charge of public health, saying he’ll “let him go wild on health.” And RFK’s been specific about what he’s been offered."
John Oliver,"The key that I—I think I’m, you know, that President Trump has promised me is—is control of the public health agencies, which are HHS and its sub-agencies CDC, FDA, NIH, and a few others."
John Oliver,"Okay, first, just wipe your camera with your sleeve, or a dead bear, or whatever else you have around. But more importantly, that’s very bad! To put it mildly, you don’t want RFK Jr. in charge of the CDC if there’s another pandemic. Or even if there isn’t!"
John Oliver,"All of that is why a bunch of our stories this year have ended with me telling you to vote against Donald Trump. But to be clear, I’m voting for Kamala Harris, and I think you should too. And if you’re a die-hard Harris supporter and were gonna do that anyway, great! But the next few minutes aren’t actually going to be for you."
John Oliver,"And if you’re a die-hard Trump supporter, they’re not for you, either, and incidentally, what the fuck are you even doing here? I presume YouTube pushed this clip to you after I played that certified banger earlier, and you got very disappointed when I called you a dipshit."
John Oliver,"But for everyone else, I just want to elaborate a bit on the sentence “Vote for Kamala Harris.” If you watch this show, you know I’ve had plenty of issues with the administration she’s been part of. Particularly when it comes to their policies on immigration and, of course, Gaza. We’ve talked multiple times about how the Biden administration’s response to the ongoing slaughter is indefensible. And people are rightly furious about it."
John Oliver,"In Michigan, more than 100,000 voters checked “uncommitted” on their primary ballots in February rather than vote for Biden. That protest vote was organized by a coalition called the Uncommitted Movement, led by Arab and Muslim American Democrats. And there are still many Michigan voters—which is, by the way, a crucial swing state—who are struggling with the idea of voting for Harris."
John Oliver,"Now, I’m a Democrat. It’s put me in a very awkward position. How can I tell the Dearborn pharmacist who lost 80 members of his family in one day to vote for the vice president? What does that mean you put on the ballot paper? I might just leave it blank. For some of us, asking who we are going to vote for at the top of the ticket and be strategic about it is like asking who we’re going to vote for while we are at a funeral. I think the Arab American community is likely not to vote for Harris. I’m fairly certain of that. I don’t know how I’m going to vote. I’m not going to lie to you. In my heart, I don’t want Trump to win. I think he’s not just a disaster for Arab Americans, but he’s also a disaster for all Americans. Deep in my heart, I’m rooting for her."
John Oliver,"Look, I get why this is so difficult. And I know there are some who won’t vote for Harris under any circumstances because of this issue. But I know there are others who may still be wrestling with this. And if it’s okay, I’d like to talk to you for a second."
John Oliver,"And first, let me say: I wish Harris had done more to reach out to you, beyond sending Bill Clinton to basically scold you this week. That didn’t seem remotely helpful, and honestly felt a bit like bullying, and as we all know, bullying accomplishes almost nothing. And I fully understand why a message from me might not be welcome either."
John Oliver,"But for what it’s worth, I’ve been moved by some Muslim and Arab voices who’ve also wrestled hard with this question and arrived at the conclusion, despite their pain, to vote for Harris."
John Oliver,"In Arizona, a coalition of community leaders issued a letter in which they explained their decision to support her, saying, “A Trump win would be an extreme danger to Muslims in our country, all immigrants, and the American pro-Palestine movement.” And they’re not alone in feeling that way."
John Oliver,"Ruwa Romman is the first Muslim woman elected to the Georgia State House. You may remember, she’s one of several Palestinians who the Uncommitted Movement put forward to address this year’s DNC, only to be rejected by the party. Meaning the convention featured no Palestinian speakers. She actually released this TikTok a few weeks ago—partly in response to people telling her she should abandon the Democratic Party because both parties are basically the same."
John Oliver,"It’s worth watching the whole thing, but she talks about her anger at what happened—but also about the DNC delegates who stood up for her, and those that she sees as movable on this issue. And this is where she lands:"
John Oliver,"If I know that one party—there is only one viable party on the trajectory that I want them on, why would I leave that behind? There are people who are using my pain to virtue signal and convince you that the threats that we are facing are not actually that big of a deal. My philosophy is that if I can prevent the death of even a single person, I will make the decisions to do that. Period. End of story. I do not believe in the fact that just because things are bad, that it’s okay to let them get worse."
John Oliver,"It’s a compelling argument. And if you’re thinking, “The Biden administration’s been so bad on this issue, how could Trump be worse?” He’s told us. He told Netanyahu to “do what you have to do” in Gaza, arguing we should let Israel “finish the job,” while people in Trump’s orbit, including his former ambassador to Israel, have been pushing to let it annex the West Bank. Meanwhile, Trump’s also hinted at going after Palestinians in the U.S. and deporting demonstrators."
John Oliver,"I know it’s hard to imagine things getting worse on this, but to be fair, Trump has a proven track record of digging us into a new layer of hell. That’s not AI, by the way. That’s a real photo. It may be the worst photo of anyone ever taken."
John Oliver,"And it’s worth factoring in that the damage of a second Trump term would last far beyond the next four years and encumber any potential progressive president in the future. Two of the current justices are at retirement age, and because one of them rudely didn’t take my very generous bus offer earlier this year, Trump could replace them with younger versions. At that point, he’d have appointed five members of the court and cemented a majority that’ll likely last for the rest of my life—which, admittedly, may not actually be that long if Measles McGee here is allowed to let everything get out of control."
John Oliver,"Look, I know this isn’t inspiring to hear. But politics isn’t always inspiring—it’s transactional. It rarely matches our greatest hopes and dreams. I’ll be honest—I really didn’t want the first vote I cast as an American citizen to be for Joe Fucking Biden , but here we are."
John Oliver,"Here’s how I look at it: the struggle for justice isn’t just about what happens on Election Day. It’s a fight waged constantly, day in, day out, in protests on the street, meetings with legislators, and in the thousand small actions that cumulatively move the government forward, an inch at a time."
John Oliver,"Abbas Alawieh , a co-founder of the Uncommitted Movement, has urged Democrat voters to “pair their vote, their support for Vice President Harris, with a public commitment to pressure her to stop sending weapons, should she become president."
John Oliver,"As for Ruwa Romman , she voted for Harris in Georgia—another critical swing state—while doing a vote-swap with someone in a blue state, who cast a protest vote on her behalf. And she explained her Harris vote by saying:"
John Oliver,My vote is a promise—a promise that I and those who stand with me will not stop demanding the end of mass slaughter and violence everywhere.
John Oliver,"And that’s the point. Elections alone aren’t sufficient for large-scale change, but they’re absolutely necessary for it to ever happen, because it’s the day when you, essentially, get to choose who you’d prefer to be pushing for the next four years and where you’ll be pushing them from."
John Oliver,"Look, I love this country. I’m an immigrant and I chose to come here. In the words of the late Lee Greenwood , “I’m proud to be an American.” And I’d argue there’s nothing more American than having a healthy adversarial relationship with those in power—even if you voted for them."
John Oliver,"And while I know this hasn’t been an uplifting speech, if it helps at all, there’s one final thing I’m going to be genuinely excited for on Tuesday. And that is, if Donald Trump loses this election, he is basically finished. I know he’d put us through hell before he left the stage. But when the dust settled, he’d have lost two elections in a row and would be campaigning as an 82-year-old next time. I think he’d be done."
John Oliver,And doesn’t that sound great? [Cheers and applause]
John Oliver,"And the problems he’s a symptom of would obviously remain, but we wouldn’t have to deal with him anymore. Wouldn’t it be great to live in a world where he’s just an annoyance, and not an active threat? Where this photo could just be funny, rather than having geopolitical implications? Where he can yell about ice cream machines and complain about windmills, and we all have the option of just not giving a shit about any of it?"
John Oliver,"I want so badly to live in that world. And I hope everyone does everything in their power, in the next 48 hours, to make that world possible."
John Oliver,That’s our show. Thank you so much for watching. We will see you next week. Good night!
John Oliver,"I’m angry! Five, six, seven, eight. Beetlejuice, Beetlejuice, Beetlejuice!"
Main Segment,Business career of Donald Trump Other segment: 2024 United States presidential election
Fun Fact,"those accounts were suspended, suggesting Truth Social’s not so much a platform where freedom lives as one where freedom kisses daddy’s caboose . And the company’s not doing that hot financially, either. Their filings show little revenue and large losses. But it’s basically functioning as a meme stock right now—one that goes up because there’s a frenzy around it online, but that frenzy is divorced from its underlying value."
Announcer,"And now, our annual look at the wonder that is Halloween on local TV."
