name,monologue
Alysha Palumbo,"You can see an agent using a large hammer to break the back passenger window of their car. Marilu said the agents were focused on her husband, Juan, but kept calling him Antonio. That’s the name of another man who lives in their building. Thinking this is a case of mistaken identity, Juan called his attorney, who told him to stay in the car until she got there. But instead of waiting for their lawyer, the agent smashed the car window, broke into the vehicle, and dragged the couple out."
Marilu,They had no reason to detain him. We’ve been following the rules of this country. We are doing things the right way. That’s why we have a lawyer.
Patrick Terpstra,"Suguru Onda, getting a PhD at Brigham Young University in Utah, had his legal status in the US suddenly revoked after a criminal records check. But Onda, from Japan, had no criminal charges on his record, just two speeding tickets and a citation for catching “one too many fish,” his attorney says."
Reporter,"Sarah Saldaña believes if arrest numbers don’t increase as rapidly as the administration hopes, it might abandon the worst-first strategy and begin targeting community locations like day labor sites."
David Culver,"Inmates are assigned to one of eight sectors, each roughly the size of an airplane hangar, basically prisons within the prison. Once inside, it’s said to be a life sentence. They’ll never leave their assigned sector. Each sector holds more than two dozen large cells, roughly 80 inmates per cell, but that can fluctuate. Inside each cell, toilets, a concrete basin for bathing, and a barrel of drinking water, several rows of metal bunk beds. No mattresses, no sheets, no privacy."
Cecilia Vega,"In Andry’s case, the only evidence the government presented in immigration court were these pictures of his tattoos. Crowns, which immigration authorities say can be a symbol of Tren de Aragua."
Lindsay Toczylowski,The crowns themself were on top of the names of his parents. The most plausible explanation for that are that his mom and dad are his king and queen.
Cecilia,A Department of Homeland Security spokeswoman said on social media that its intelligence assessments go well beyond just gang affiliate tattoos. She said Andry’s own social media indicates he is a member of Tren de Aragua. We went back a decade and could only find photos like these.
Cecilia,"Tattoos and social media were also used to link another Venezuelan migrant, Jerce Reyes Barrios, to the Tren de Aragua gang. Immigration court documents include this Facebook post from 14 years ago, showing him flashing what officers said was a gang sign. His girlfriend told us it was all about rock and roll. Immigration agents also flagged Jerce’s crown tattoo as a gang symbol, but they did not mention the crown is above a soccer ball. Jerce was a soccer player in Venezuela. His lawyer says the tattoo honors his favorite team, Real Madrid."
Neighbor,Woke up to this this morning.
